{
 "schema": 1,
 "name": "NDS company technology stack",
 "snapshot_date": "2026-10-25",
 "generated_at": "2026-10-25T13:32:33Z",
 "policy": {
  "rule": "Only the latest stable upstream version is admitted; a lower version requires a recorded reason and a recheck date.",
  "scopes": {
   "core": "Product, platform and standards repositories adopting the stack.",
   "experimental": "Hackathon and guild repositories: proxied by the cache, not bound by the single stack.",
   "archive": "Archived repositories: not migrated."
  }
 },
 "toolchains": [
  {
   "id": "rust",
   "upstream_latest": "1.99.1",
   "stack": "1.99.1",
   "status": "latest",
   "scope": "core",
   "upstream_detail": {
    "detail": "1.99.1 (58cf8f9c3 2026-10-13)",
    "published": "2026-10-15"
   },
   "source": "https://static.rust-lang.org/dist/channel-rust-stable.toml",
   "verified_at": "2026-10-25T12:49:53Z"
  },
  {
   "id": "node",
   "upstream_latest": "v26.12.1",
   "stack": "26.12.1",
   "status": "latest",
   "scope": "core",
   "note": "Node 26 is Current until it becomes Active LTS on 2026-10-28; Node 24 entered Maintenance on 2026-10-20. Node 26.12.1 bundles npm 11.20.0; standalone npm latest is 12.2.1.",
   "upstream_detail": {
    "published": "2026-10-21",
    "latest_lts": "v24.22.1",
    "lts_codename": "Krypton",
    "lts_date": "2026-10-20",
    "active_lts_lines": [],
    "schedule_current_line": "v26"
   },
   "source": "https://nodejs.org/dist/index.json + nodejs/Release schedule.json",
   "verified_at": "2026-10-25T12:49:53Z"
  },
  {
   "id": "bun",
   "upstream_latest": "bun-v1.4.4",
   "stack": "1.4.4",
   "status": "latest",
   "scope": "core",
   "note": "Primary JS/TS package manager and runtime per playbook-dev-devices.",
   "upstream_detail": {
    "published": "2026-10-22T10:11:32Z"
   },
   "source": "https://github.com/oven-sh/bun/releases",
   "verified_at": "2026-10-25T12:49:53Z"
  },
  {
   "id": "python",
   "upstream_latest": "3.15.1",
   "stack": [
    "3.15.1",
    "3.14.9"
   ],
   "status": "latest+compat",
   "scope": "core",
   "reason": "Owner selects both lines. 3.15 is the latest; 3.14 is admitted for projects whose locked set does not resolve on 3.15. The core whole-set uv resolution succeeds on 3.14 and fails on 3.15 (ctranslate2/faster-whisper publish no cp315 wheels; livekit-agents requires <3.15).",
   "upstream": [
    "https://github.com/OpenNMT/CTranslate2/pull/2129"
   ],
   "removal_condition": "The 3.14 line stays while any core project needs it; re-run the core resolution on 3.15 after CTranslate2 publishes cp315 wheels and livekit-agents allows 3.15.",
   "upstream_detail": {
    "published": "2026-10-21",
    "branches": {
     "3.11": {
      "latest": "3.11.17",
      "status": "security"
     },
     "3.12": {
      "latest": "3.12.15",
      "status": "security"
     },
     "3.13": {
      "latest": "3.13.17",
      "status": "security"
     },
     "3.14": {
      "latest": "3.14.9",
      "status": "bugfix"
     },
     "3.15": {
      "latest": "3.15.1",
      "status": "bugfix"
     }
    },
    "prerelease_branches": [
     "3.16"
    ]
   },
   "source": "https://www.python.org/api/v2/downloads/release/ + https://peps.python.org/api/release-cycle.json",
   "verified_at": "2026-10-25T12:49:53Z"
  },
  {
   "id": "uv",
   "upstream_latest": "0.13.5",
   "stack": "0.13.5",
   "status": "latest",
   "scope": "core",
   "upstream_detail": {
    "published": "2026-10-22T01:35:54Z"
   },
   "source": "https://github.com/astral-sh/uv/releases",
   "verified_at": "2026-10-25T12:49:53Z"
  },
  {
   "id": "python-build-standalone",
   "stack": "20261021",
   "status": "latest",
   "scope": "core",
   "verified_at": "2026-10-25T12:49:53Z",
   "upstream_latest": "20261021",
   "source": "https://github.com/astral-sh/python-build-standalone/releases"
  },
  {
   "id": "go",
   "upstream_latest": "go1.27.3",
   "stack": "go1.27.3",
   "status": "latest",
   "scope": "core",
   "upstream_detail": {
    "supported": [
     "go1.27.3",
     "go1.26.10"
    ]
   },
   "source": "https://go.dev/dl/?mode=json",
   "verified_at": "2026-10-25T12:49:53Z"
  },
  {
   "id": "flutter+dart",
   "upstream_latest": "3.47.8",
   "stack": "3.47.8",
   "status": "latest",
   "scope": "core",
   "note": "Dart 3.13.7 bundled.",
   "upstream_detail": {
    "dart": "3.13.7",
    "published": "2026-10-23T19:02:25.384067Z",
    "archive": "https://storage.googleapis.com/flutter_infra_release/releases/stable/linux/flutter_linux_3.47.8-stable.tar.xz",
    "sha256": "baf7dcc5a3dbba60fe863bf493a6cf203195621f7786eaa5a1bba02cd0d87dd2"
   },
   "source": "https://storage.googleapis.com/flutter_infra_release/releases/releases_linux.json",
   "verified_at": "2026-10-25T12:49:53Z"
  },
  {
   "id": "typescript",
   "upstream_latest": "7.0.2",
   "stack": [
    "7.0.2",
    "6.0.3"
   ],
   "status": "latest+compat",
   "scope": "core",
   "reason": "Owner selects TypeScript 7 (native compiler) and the latest TypeScript 6 (JavaScript compiler API for typescript-eslint, openapi-typescript, @astrojs/check, svelte-language-server). The @typescript/typescript6 alias package currently publishes 6.0.2; alias npm:typescript@6.0.3 instead.",
   "upstream_detail": {
    "tags": {
     "rc": "7.0.1-rc",
     "beta": "7.1.0-beta",
     "next": "7.1.0-dev.20261025.1"
    }
   },
   "source": "https://registry.npmjs.org/-/package/typescript/dist-tags",
   "verified_at": "2026-10-25T12:49:53Z",
   "upstream": [
    "https://github.com/typescript-eslint/typescript-eslint/issues/10940",
    "https://github.com/openapi-ts/openapi-typescript/issues/2841",
    "https://github.com/withastro/astro/pull/17852"
   ],
   "removal_condition": "The TypeScript 6 line stays until typescript-eslint, openapi-typescript and @astrojs/check run on TypeScript 7."
  },
  {
   "id": "npm",
   "upstream_latest": "12.2.1",
   "stack": "12.2.1",
   "status": "latest",
   "scope": "core",
   "note": "Fallback only; Node 26.12.1 bundles 11.20.0.",
   "upstream_detail": {
    "tags": {}
   },
   "source": "https://registry.npmjs.org/-/package/npm/dist-tags",
   "verified_at": "2026-10-25T12:49:53Z"
  },
  {
   "id": "pnpm",
   "upstream_latest": "12.15.0",
   "stack": "12.15.0",
   "status": "latest",
   "scope": "experimental-only",
   "upstream_detail": {
    "tags": {}
   },
   "source": "https://registry.npmjs.org/-/package/pnpm/dist-tags",
   "verified_at": "2026-10-25T12:49:53Z"
  },
  {
   "id": "just",
   "upstream_latest": "1.59.0",
   "stack": "1.59.0",
   "status": "latest",
   "scope": "core",
   "upstream_detail": {
    "published": "2026-10-15T06:41:04Z"
   },
   "source": "https://github.com/casey/just/releases",
   "verified_at": "2026-10-25T12:49:53Z"
  },
  {
   "id": "mise",
   "upstream_latest": "v2026.10.19",
   "stack": "v2026.10.19",
   "status": "latest",
   "scope": "core",
   "upstream_detail": {
    "published": "2026-10-24T20:02:03Z"
   },
   "source": "https://github.com/jdx/mise/releases",
   "verified_at": "2026-10-25T12:49:53Z"
  },
  {
   "id": "jdk",
   "upstream_latest": "27.0.1+0",
   "stack": [
    "27.0.1",
    "25.0.5"
   ],
   "status": "latest+lts",
   "scope": "core",
   "reason": "Owner selects the latest feature release and the latest LTS. Gradle runs on JDK 27 only from 9.8.0; with the Kotlin-compatible Gradle line use JDK 25. Kotlin 2.4.21 -jvm-target stops at 26 and Flutter 3.47.8 treats Java >=26 as newer-than-known, so Android/Flutter apps keep Java target 17.",
   "note": "playbook-dev-devices installs JDK 27 and JDK 21 (jvm-lts); the LTS line it installs needs to move to 25.",
   "upstream": [
    "https://raw.githubusercontent.com/JetBrains/kotlin-web-site/master/docs/v.list"
   ],
   "removal_condition": "None for the two-line policy; the Java 17 app target follows Flutter/Kotlin support for newer targets.",
   "upstream_detail": {
    "latest_feature": 27,
    "latest_lts": 25,
    "available_lts": [
     17,
     21,
     25
    ],
    "latest_lts_build": "25.0.5+8.0.LTS"
   },
   "source": "https://api.adoptium.net/v3/info/available_releases",
   "verified_at": "2026-10-25T12:49:53Z"
  },
  {
   "id": "gradle",
   "upstream_latest": "9.8.2",
   "stack": [
    "9.8.2",
    "9.7.1"
   ],
   "status": "latest+compat",
   "scope": "core",
   "reason": "Owner selects the latest Gradle and the newest Gradle fully supported by Kotlin Gradle Plugin 2.4.21 (Gradle 7.6.3-9.7.0; 9.7.1 is its bug-fix patch). Kotlin/Android builds use the compatible line.",
   "upstream": [
    "https://raw.githubusercontent.com/JetBrains/kotlin-web-site/master/docs/v.list"
   ],
   "removal_condition": "A Kotlin Gradle Plugin release that lists Gradle >=9.8 makes the latest line sufficient.",
   "upstream_detail": {
    "published": "20261019162926+0000"
   },
   "source": "https://services.gradle.org/versions/current",
   "verified_at": "2026-10-25T12:49:53Z"
  },
  {
   "id": "android-gradle-plugin",
   "upstream_latest": "9.4.1",
   "stack": [
    "9.4.1",
    "9.3.3"
   ],
   "status": "latest+compat",
   "scope": "core",
   "reason": "The owner's Gradle rule applied to AGP: the latest release and the newest release fully supported by Kotlin Gradle Plugin 2.4.21 (AGP 8.5.2-9.3.1; 9.3.3 is a bug-fix patch). AGP 9.4 requires Gradle >=9.6.0.",
   "upstream": [
    "https://raw.githubusercontent.com/JetBrains/kotlin-web-site/master/docs/v.list"
   ],
   "removal_condition": "A Kotlin Gradle Plugin release that lists AGP >=9.4.",
   "source": "https://dl.google.com/dl/android/maven2/com/android/tools/build/gradle/maven-metadata.xml",
   "verified_at": "2026-10-25T12:49:53Z"
  },
  {
   "id": "kotlin",
   "upstream_latest": "2.4.21",
   "stack": "2.4.21",
   "status": "latest",
   "scope": "core",
   "note": "org.jetbrains.kotlin.plugin.compose must equal 2.4.21.",
   "source": "https://repo1.maven.org/maven2/org/jetbrains/kotlin/kotlin-gradle-plugin/maven-metadata.xml",
   "verified_at": "2026-10-25T12:49:53Z"
  },
  {